"20 Lavington Street Southwark London SE1 0NZ United Kingdom",804,"7/31/2016",9.1,"citizenM London Bankside"," Netherlands "," Breakfast",2,3802," Friendly staff Great bed",5,1,"368 day",51.5051507,-0.1004723999999999,1,1,0,0,0,1,1,0,0,0,0,1,0,0,0,0,0,0,0,0,0,0,0,0,0,0,0,0,0,0,0,0,0,0,0,0,0,0,0,0,0,0,0,0,0,0,0,0,0,0,0,0,0,0,0,0,0,0,0,0,0,0,0,0,8.8
"12 Osborn Street Aldgate East Tower Hamlets London E1 6TE United Kingdom",404,"8/3/2017",8.9,"Arbor City"," Canada "," The neighbourhood could be a bit dirty and sketchy at night ",13,2197," Nice hotel very clean and modern Close to aldegatr east tube station making it easy to get anywhere ",20,12,"0 days",51.5166755,-0.0697897,1,1,1,0,0,0,0,0,0,0,0,0,0,0,0,0,0,1,0,0,0,0,0,0,0,0,0,0,0,0,0,1,0,0,0,0,0,0,0,0,0,0,0,0,0,0,0,0,0,0,0,0,0,0,0,0,0,0,0,0,0,0,0,0,10.0
"20 Lavington Street Southwark London SE1 0NZ United Kingdom",804,"1/26/2016",9.1,"citizenM London Bankside"," United Kingdom "," A little bit more space",6,3802," Nice modern clean room",5,1,"555 day",51.5051507,-0.1004723999999999,1,0,1,0,1,0,0,0,0,0,0,1,0,0,0,0,0,0,0,0,0,0,0,0,0,0,0,0,0,0,0,0,0,0,0,0,0,0,0,0,0,0,0,0,0,0,0,0,0,0,0,0,0,0,0,0,0,0,0,0,0,0,0,0,8.3
"100 Queen s Gate Kensington and Chelsea London SW7 5AG United Kingdom",541,"11/17/2015",8.0,"Doubletree by Hilton London Kensington"," Nigeria "," Noise from kids in a nearby school had to pay for WiFi Hotel collected deposit of 50 pounds from my card and i did not receive it within a week after the refund was made ",37,2367," Very helpful staff and value for money Good location in terms of the vicinity beautiful ",17,15,"625 day",51.4925138,-0.1787917,0,0,0,1,0,1,0,1,0,0,0,0,0,0,0,0,0,0,0,0,0,0,0,0,0,0,0,0,0,0,0,0,0,0,0,0,0,0,0,0,0,0,0,0,0,0,0,0,0,0,0,0,0,0,0,0,0,0,0,0,0,0,0,0,7.9
"2 Whitehall Court Westminster Borough London SW1A 2EJ United Kingdom",475,"8/14/2015",8.9,"The Royal Horseguards"," United States of America "," The concierge should have more local knowledge of restaurants and nightspots We were sent to a few places that didn t fit our needs Very friendly and helpful though ",31,2007," The staff was unbelievably friendly and helpful especially Mitch ",11,12,"720 day",51.5054185,-0.1241499,1,1,0,0,1,0,0,0,0,0,0,0,0,0,1,1,0,0,0,0,0,0,0,0,0,0,0,0,0,0,0,0,0,0,0,0,0,0,0,0,0,0,0,0,0,0,0,0,0,0,0,0,0,0,0,0,0,0,0,0,0,0,0,0,10.0
"140 Gloucester Road Kensington and Chelsea London SW7 4QH United Kingdom",528,"4/24/2016",8.7,"The Bailey s Hotel London"," Kuwait "," Room smaller than average rooms in the hotel Charged me extra 24 pounds because I left the room at 3 pm Internet is 10 pounds a day",28,2485," Location",2,1,"466 day",51.4938733,-0.1824963,1,1,0,0,0,1,0,0,0,0,0,0,0,0,0,0,0,0,0,1,0,0,0,0,0,0,1,0,0,0,0,0,0,0,0,0,0,0,0,0,0,0,0,0,0,0,0,0,0,0,0,0,0,0,0,0,0,0,0,0,0,0,0,0,7.9
"2 24 Kensington High St Kensington and Chelsea London W8 4PT United Kingdom",617,"11/18/2016",8.8,"Royal Garden Hotel"," Russia "," I like everything really",5,2213," If there is any problem I would not come to this hotel that often ",16,10,"258 day",51.50270220000001,-0.1882164,1,1,1,0,0,0,0,0,0,0,1,0,0,0,0,0,0,0,0,0,0,0,0,0,0,0,0,0,0,0,0,0,1,0,0,0,0,0,0,0,0,0,0,0,0,0,0,0,0,0,0,0,0,0,0,0,0,0,0,0,0,0,0,0,10.0
"147 Cromwell Road Kensington and Chelsea London SW5 0TH United Kingdom",105,"11/8/2016",8.0,"London Marriott Hotel Kensington"," Belize "," Had a problem with incoming phone calls Need to check that service",13,449," Excellent breakfast ",4,3,"268 day",51.4944849,-0.1884173999999999,0,0,0,0,1,1,0,1,0,0,0,0,0,0,0,0,0,0,0,0,0,0,0,0,0,0,0,0,0,0,0,0,0,0,0,0,0,0,0,0,0,0,0,0,0,0,0,0,0,0,0,0,0,0,0,0,0,0,0,0,0,0,0,0,9.2
"1 3 Queens Garden Westminster Borough London W2 3BA United Kingdom",1058,"1/26/2016",7.7,"The Park Grand London Paddington"," United Kingdom "," The only down side to the hotel is the beds and pillows First the pillows are like bricks I recommend taking your own pillow if you have to you wake up with sore red ears off them Also the beds are not too comfy could be better I didn t want to think what our room would of been like without the free upgrade But overall for the price I paid which was 153 it wasn t bad as that included breakfast for 2 You can pay a lot more in London for the same service ",98,4380," Staff are very polite and helpful Gave us a free upgrade without asking which was nice Pretty central and not to far on the tube for attractions like Buckingham Palace probably about 15 min train ride Staff also gave us a late check out without charging us which we was made up with as we wasn t leaving London until 7pm Overall good experience",65,1,"555 day",51.5142184,-0.1809032,1,1,0,1,0,0,0,0,1,0,0,0,0,0,0,0,0,0,0,0,0,0,0,0,0,0,0,0,0,0,0,0,0,0,0,0,0,0,0,0,0,0,0,0,0,0,0,0,1,0,0,0,0,0,0,0,0,0,0,0,0,0,0,0,7.1
"1a Lexham Gardens Kensington and Chelsea London W8 5JJ United Kingdom",222,"3/6/2017",7.5,"Mercure London Kensington Hotel"," United Kingdom "," Noise from the corridors was far to loud especially the cleaners who started really early Air conditioning was so noisy you had to turn it off Room size was very small it was expected However not being able to walk past the end of the bed wasnt",48,1016," Location Breakfast",3,14,"150 day",51.4950098,-0.1906195,1,0,0,0,1,0,0,0,0,1,0,0,0,0,0,0,0,0,0,0,0,0,0,0,0,0,0,0,0,0,0,0,0,0,0,0,0,0,0,0,0,0,0,0,0,0,1,0,0,0,0,0,0,0,0,0,0,0,0,0,0,0,0,0,7.1
"17 Boulevard Saint Jacques 14th arr 75014 Paris France",37,"2/12/2017",7.5,"Paris Marriott Rive Gauche Hotel"," Czech Republic "," the room is small has to be reconstructed breakfast expensive but nothing great",14,239," good location close to metro and railway station",9,29,"172 day",48.83159620000001,2.3399796000000004,0,0,0,1,0,1,0,1,0,0,0,0,0,0,0,0,0,0,0,0,0,0,0,0,0,0,0,0,0,0,0,0,0,0,0,0,0,0,0,0,0,0,1,0,0,0,0,0,0,0,0,0,0,0,0,0,0,0,0,0,0,0,0,0,5.8
"18 Albert Embankment Lambeth London SE1 7TJ United Kingdom",1195,"10/2/2016",8.3,"Park Plaza London Riverbank"," Jordan "," It was not as quiet as I expected ",10,4684," I liked the furniture and the decorations Also the staff working at the hotel are so friendly Moreover the food is great",23,1,"305 day",51.4913737,-0.1214194,0,0,1,0,0,0,1,0,0,0,0,0,0,0,0,0,0,0,0,0,0,0,0,0,0,0,0,0,0,1,0,0,0,0,0,0,0,0,0,0,0,0,0,0,0,0,0,0,0,0,0,0,0,0,0,0,0,0,0,0,0,0,0,0,9.5
"153 Hammersmith Road Hammersmith and Fulham London W14 0QL United Kingdom",204,"8/30/2016",9.0,"St Paul s Hotel"," United Kingdom "," Room service breskfast would have been nice",8,812," Beautiful hotel perfect location",5,2,"338 day",51.493475200000006,-0.2153255999999999,1,1,1,1,0,0,0,0,0,0,0,0,0,0,0,0,0,0,0,1,0,0,0,0,0,0,0,0,0,0,0,0,0,0,0,0,0,0,0,0,0,0,0,0,0,0,0,0,0,0,0,0,0,0,0,0,0,0,0,0,0,0,0,0,9.6
